{
  "requestId": "01K4A000000000000000000001",
  "newsId": "01K4A000000000000000000002",
  "title": "Bitcoin rises as crypto markets rally",
  "content": "Java normalized this English article before sentiment analysis.",
  "language": "en",
  "contentHash": "sha256:0123456789abcdef0123456789abcdef0123456789abcdef0123456789abcdef",
  "contractVersion": "sentiment-v1",
  "modelName": "multichannel-english",
  "modelVersion": "multichannel-english-1.0.0",
  "preprocessingVersion": "multichannel-whitespace-en-1"
}
